{
  "schema_version": "0.1.0",
  "library_type": "practice_lens",
  "last_updated_at": "2026-10-10T15:20:00+09:00",
  "items": [
    {
      "card_id": "LENS-001",
      "title": "現地で何を持ち帰るかを、後工程の必要から先に決める",
      "business_model_tags": [
        "project_based"
      ],
      "value_chain_stages": [
        "survey"
      ],
      "boundary_context": null,
      "observation": "設置場所・施工場所を見に行くとき、写真・寸法・周辺状況・搬入経路のうち、設計・見積・施工がそれぞれ必要とするものを、出発前に決める。",
      "why_it_matters": "持ち帰り漏れは設計・見積のやり直しと施工当日の手戻りになり、効率と品質に直結する。",
      "examples": [
        {
          "industry": "signage",
          "scene": "営業担当が看板の設置予定地に行き、設計と施工のために壁面の寸法・取付け面の状態・周辺道路・電源の位置まで撮ってから帰る。"
        },
        {
          "industry": "electrical",
          "scene": "電気工事の担当者が見積前に現地へ行き、機器の設置位置と配線の経路、既設の盤の状態を見て仕様書に書き込んでから見積りに落とす。"
        }
      ],
      "prompt": "現地を見に行ったとき、後の人のために必ず持ち帰るものは何ですか。",
      "anti_pattern": "「写真を撮ってきた」で終わり、何を撮るかが行った人任せになっている。",
      "sources": [
        "屋外広告業 モデル評価シート・モデルカリキュラム（厚労省報道発表別添 2012-05）",
        "JOB tag 看板制作",
        "JOB tag 電気工事士",
        "職業能力評価基準 電気通信工事業"
      ],
      "field_validation": {
        "cases_count": 0
      },
      "review_status": "unreviewed",
      "created_at": "2026-10-10T01:24:00+09:00",
      "updated_at": "2026-10-10T02:10:00+09:00"
    },
    {
      "card_id": "LENS-002",
      "title": "見積りを、誰の目を通してから出すかを決める",
      "business_model_tags": [
        "project_based",
        "store_retail"
      ],
      "value_chain_stages": [
        "intake"
      ],
      "boundary_context": {
        "from": "store_retail",
        "to": "project_based"
      },
      "observation": "材料の種類判定と工数の積み上げを、担当者が一人で出すか、前例の有無を見て上級者の判断を通してから出すかを決める。",
      "why_it_matters": "見積りの精度は粗利と手戻りを決め、上級者だけが持つ積算の判断は継承の対象になる。",
      "examples": [
        {
          "industry": "signage",
          "scene": "前例の無い形状の看板の見積りで、担当者が材料と工数を積み上げたあと、ベテランの職人に材料の種類判定を見直してもらってから依頼主に出す。"
        },
        {
          "industry": "retail",
          "scene": "菓子店で祝い用の注文菓子を受けたとき、材料と手間を積み上げた見積りを親方が見てから客に金額を伝える。"
        },
        {
          "industry": "electrical",
          "scene": "電気工事の営業担当が、前例の無い改修案件の見積りを出す前に、施工側の職長に工法と工数を確かめてから金額を出す。"
        }
      ],
      "prompt": "見積りを出す前に、誰が、どこを見て直しますか。",
      "anti_pattern": null,
      "sources": [
        "広告美術仕上げ技能士（技能検定）",
        "職業能力評価基準 屋外広告業",
        "菓子製造技能検定 試験科目及びその範囲並びにその細目（厚労省）",
        "職業能力評価基準 電気通信工事業",
        "JOB tag 電気工事士"
      ],
      "field_validation": {
        "cases_count": 0
      },
      "review_status": "unreviewed",
      "created_at": "2026-10-10T01:24:00+09:00",
      "updated_at": "2026-10-10T02:10:00+09:00"
    },
    {
      "card_id": "LENS-003",
      "title": "計画・契約の外の依頼を、受けるか断るか戻すかを決める",
      "business_model_tags": [
        "store_retail",
        "human_service",
        "project_based"
      ],
      "value_chain_stages": [
        "intake",
        "production",
        "handoff",
        "after"
      ],
      "boundary_context": {
        "from": "store_retail",
        "to": "project_based"
      },
      "observation": "予約・贈答・保険外・工事の追加のように計画や契約の外にある依頼を受けたとき、その場で受けるか、区分して受けるか、断って正式な変更（見積・計画変更・上長対応）に戻すかを決める。",
      "why_it_matters": "受ける線が人で違うと、約束の履行・採算・記録・同意が案件ごとにぶれ、顧客価値と効率を同時に損なう。",
      "examples": [
        {
          "industry": "retail",
          "scene": "繁忙期に客から贈答用の包装と予約を頼まれたレジ係が、その場で受けるか、店長に確かめてから受けるかを決める。"
        },
        {
          "industry": "care",
          "scene": "訪問中に利用者の家族から家族の部屋の掃除も頼まれた訪問介護員が、その場で断って理由を説明するか、サービス提供責任者に戻して計画の話にするかを決める。"
        },
        {
          "industry": "care",
          "scene": "利用者から大掃除や草むしりを頼まれたサービス提供責任者が、保険外サービスとして区分して受けるか、他の支援先を案内するかを決める。"
        },
        {
          "industry": "electrical",
          "scene": "現場で元請から工事内容の追加を頼まれた施工管理者が、その場で作業に入るか、見積りを出して下請と工期を調整してから入るかを決める。"
        },
        {
          "industry": "retail",
          "scene": "返品を持ち込まれたレジ係が、その場で処理するか、店長に上げるかを決める。"
        }
      ],
      "prompt": "「それもお願い」と言われたとき、受ける・受けないを何で決めていますか。",
      "anti_pattern": null,
      "sources": [
        "JOB tag スーパーレジ係",
        "スーパーマーケット白書 2025年版",
        "JOB tag スーパー店長",
        "職業能力評価基準 スーパーマーケット業",
        "老振第76号 指定訪問介護事業所の事業運営の取扱等について",
        "札幌市 訪問介護 自己点検シート（基準条例・解釈通知の再掲）",
        "千葉県 集団指導資料 訪問介護（R5）",
        "キャリアマップ・職業能力評価シート 導入・活用マニュアル（在宅介護業）",
        "JOB tag 訪問介護のサービス提供責任者",
        "職業能力評価基準 電気通信工事業",
        "JOB tag 建築施工管理技術者",
        "国土交通省 電気通信設備工事監督技術基準（案）令和6年3月"
      ],
      "field_validation": {
        "cases_count": 0
      },
      "review_status": "unreviewed",
      "created_at": "2026-10-10T01:24:00+09:00",
      "updated_at": "2026-10-10T02:10:00+09:00"
    },
    {
      "card_id": "LENS-004",
      "title": "制度・条例の線を、入口で引くか現場で引くかを決める",
      "business_model_tags": [
        "project_based",
        "human_service"
      ],
      "value_chain_stages": [
        "intake",
        "survey",
        "design"
      ],
      "boundary_context": null,
      "observation": "自治体の条例や給付範囲など「できる・できない」を決める制度の線を、受注・計画の段階で確認して顧客と合意しておくか、現場の担当者が初めて引くかを決める。",
      "why_it_matters": "現場で初めて線を引くと、断る相手が目の前の顧客になり、適法性（品質）と顧客価値の両方を損なう。",
      "examples": [
        {
          "industry": "signage",
          "scene": "受注の打合せの段階で、営業担当が設置予定地の自治体の屋外広告物条例を調べ、看板の大きさと設置可否を依頼主に伝えてから設計に回す。"
        },
        {
          "industry": "care",
          "scene": "契約のとき、サービス提供責任者が利用者と家族に介護保険でできる家事とできない家事を説明して合意しておき、訪問介護員が現場で初めて断らなくて済むようにする。"
        }
      ],
      "prompt": "「それはできません」の線を、契約や計画の段階で、誰がどう伝えていますか。",
      "anti_pattern": null,
      "sources": [
        "屋外広告業 モデル評価シート・モデルカリキュラム（厚労省報道発表別添 2012-05）",
        "JOB tag 看板制作",
        "老振第76号 指定訪問介護事業所の事業運営の取扱等について",
        "札幌市 訪問介護 自己点検シート（基準条例・解釈通知の再掲）"
      ],
      "field_validation": {
        "cases_count": 0
      },
      "review_status": "unreviewed",
      "created_at": "2026-10-10T01:24:00+09:00",
      "updated_at": "2026-10-10T02:10:00+09:00"
    },
    {
      "card_id": "LENS-005",
      "title": "資格・法令上、その作業を誰ならやってよいかを決める",
      "business_model_tags": [
        "project_based"
      ],
      "value_chain_stages": [
        "design",
        "install",
        "close"
      ],
      "boundary_context": null,
      "observation": "資格や法令で担当者が限定される作業（構造計算・電源接続・完了検査）について、案件の規模と設備の種類から必要な資格を見て、その作業を誰ならやってよいかを着手前に決める。",
      "why_it_matters": "線が曖昧なまま進むと法令違反と事故の両方のリスクになり、安全と品質に直結する。",
      "examples": [
        {
          "industry": "signage",
          "scene": "大型の自立看板の案件で、製作・施工管理者が風圧・重量の計算を社内で済ませてよい規模か、建築士でないとできない規模かを見分ける。"
        },
        {
          "industry": "signage",
          "scene": "電飾付きの看板で、施工管理者が電源の接続を自社の作業員がやってよい範囲か、電気工事士でないとできない作業かを見分ける。"
        },
        {
          "industry": "electrical",
          "scene": "工事が終わったあと、完了検査を作業した本人がやってよいか、主任電気工事士でないとできないかを見て、検査する人を決める。"
        }
      ],
      "prompt": "資格がないとできない作業は、誰ならやってよいかをどこで決めていますか。",
      "anti_pattern": null,
      "sources": [
        "JOB tag 看板制作",
        "屋外広告士（日広連）",
        "広告美術仕上げ技能士（技能検定）",
        "経済産業省（近畿）令和5年度電気工事業立入検査結果"
      ],
      "field_validation": {
        "cases_count": 0
      },
      "review_status": "unreviewed",
      "created_at": "2026-10-10T01:24:00+09:00",
      "updated_at": "2026-10-10T05:49:09+09:00"
    },
    {
      "card_id": "LENS-006",
      "title": "自社でやるか外に出すかを、何を見て決めるか",
      "business_model_tags": [
        "project_based"
      ],
      "value_chain_stages": [
        "production",
        "install"
      ],
      "boundary_context": null,
      "observation": "法令上は自社でもできる工程（構造体・基礎工事など）を、自社の技能・設備・納期・原価を見て、自社施工にするか外注にするかを案件ごとに決める。",
      "why_it_matters": "線が会社として決まっていないと、品質・納期・原価が案件ごとに担当者任せになり効率を損なう。",
      "examples": [
        {
          "industry": "signage",
          "scene": "大型看板の構造体を、製作・施工管理者が自社の工場で組むか鉄骨業者に出すかを、規模と納期を見て決める。"
        },
        {
          "industry": "signage",
          "scene": "自立看板の基礎工事を、施工担当が自社で掘って打つか土木業者に出すかを、看板の重さと設置方法を見て決める。"
        },
        {
          "industry": "electrical",
          "scene": "施工管理者が配管工事の一部を、自社の人員の空きと工期を見て、自社で持つか協力業者に出すかを決める。"
        }
      ],
      "prompt": "外に出す・出さないは、御社では何で決まりますか。",
      "anti_pattern": null,
      "sources": [
        "JOB tag 看板制作",
        "職業能力評価基準 屋外広告業",
        "職業能力評価基準 ディスプレイ業",
        "JOB tag 建築施工管理技術者",
        "職業能力評価基準 総合工事業"
      ],
      "field_validation": {
        "cases_count": 0
      },
      "review_status": "unreviewed",
      "created_at": "2026-10-10T01:24:00+09:00",
      "updated_at": "2026-10-10T05:45:59+09:00"
    },
    {
      "card_id": "LENS-007",
      "title": "外から受け取るとき、数量で済ませるか品質と作り手まで見るかを決める",
      "business_model_tags": [
        "project_based",
        "store_retail"
      ],
      "value_chain_stages": [
        "production",
        "handoff"
      ],
      "boundary_context": null,
      "observation": "外注先・納入先から受け取る物を、数量と納期の確認で済ませるか、品質と誰が実際に作ったかまで見るかを決める。",
      "why_it_matters": "受け取り時に見なかったものは、次工程か顧客の前で見つかり品質を損なう。",
      "examples": [
        {
          "industry": "retail",
          "scene": "納品された青果を受ける店員が、伝票の数量を合わせるだけで倉庫に入れるか、箱を開けて傷みを見てから受けるかを決める。"
        },
        {
          "industry": "signage",
          "scene": "外注した構造体が戻ってきたとき、施工管理者が寸法と納期だけ確かめるか、溶接と塗装の仕上がりまで見てから施工に回すかを決める。"
        },
        {
          "industry": "electrical",
          "scene": "下請に出した工事の完了報告を受けた施工管理者が、実際に作業した人の氏名まで確かめて帳簿に書く。"
        }
      ],
      "prompt": "入ってきたものを受け取るとき、数のほかに何を見ますか。",
      "anti_pattern": null,
      "sources": [
        "JOB tag スーパー店員",
        "職業能力評価基準 スーパーマーケット業 導入・活用マニュアル",
        "職業能力評価基準 外食産業",
        "職業能力評価基準 屋外広告業",
        "JOB tag 看板制作",
        "経済産業省（近畿）令和5年度電気工事業立入検査結果"
      ],
      "field_validation": {
        "cases_count": 0
      },
      "review_status": "unreviewed",
      "created_at": "2026-10-10T01:24:00+09:00",
      "updated_at": "2026-10-10T02:10:00+09:00"
    },
    {
      "card_id": "LENS-008",
      "title": "渡す前に、図面・計画のほかに何を渡すかを決める",
      "business_model_tags": [
        "repetitive_production",
        "project_based",